{
  "format_version": 1,
  "label": "ILLUSTRATIVE executed timeline: what the executor returned for plan T008. The same actions as the plan, with actual times, outcomes, one fault and its recovery actions.",
  "data_status": "illustrative",
  "executed_id": "T008-executed",
  "plan_id": "T008",
  "plan_file": "motion_plan_example.json",
  "trial": 8,
  "trial_start_minute": 1680,
  "layout_id": "robot_cell_v1",
  "executor": "python_stand_in",
  "outcome": "completed_after_recovery",
  "faults": [
    {"action_id": "A012", "cause": "binder bottle jam", "where": {"step": "dispense", "action": "pour", "ingredient": "binder_pct"}, "recovered": true, "recovery_action_ids": ["R001", "R002", "R003", "R004", "R005"]}
  ],
  "step_totals_s": {
    "planned": {
      "dispense": 1800,
      "mix": 2700,
      "press": 1800,
      "test": 4500,
      "clean": 3600
    },
    "actual": {
      "dispense": 5635,
      "mix": 2700,
      "press": 1800,
      "test": 4500,
      "clean": 3600
    }
  },
  "result": {
    "dissolution_30min_pct": 88.2,
    "hardness_kp": 7.9,
    "friability_pct": 0.31,
    "verdict": "Good"
  },
  "time_note": "actual_start_s and actual_duration_s are seconds since the start of the trial, as it happened. origin 'planned' = an action from the plan; origin 'recovery' = added by the executor to deal with the fault.",
  "actions": [
    {"id": "A001", "origin": "planned", "step": "dispense", "phase": "act", "type": "pick", "object": "vial", "from": "rack", "planned_start_s": 0, "planned_duration_s": 60, "actual_start_s": 0, "actual_duration_s": 60, "outcome": "ok", "caption": "Pick the vial from the rack."},
    {"id": "A002", "origin": "planned", "step": "dispense", "phase": "act", "type": "scan", "object": "vial", "at": "rack", "planned_start_s": 60, "planned_duration_s": 60, "actual_start_s": 60, "actual_duration_s": 60, "outcome": "ok", "reading": {"quantity": "barcode", "value": "V-008"}, "caption": "Hold the vial to the barcode scanner (read only)."},
    {"id": "A003", "origin": "planned", "step": "dispense", "phase": "act", "type": "place", "object": "vial", "to": "balance", "planned_start_s": 120, "planned_duration_s": 60, "actual_start_s": 120, "actual_duration_s": 60, "outcome": "ok", "caption": "Place the vial on the balance."},
    {"id": "A004", "origin": "planned", "step": "dispense", "phase": "act", "type": "wait", "reason": "balance tare and stabilisation before dosing", "planned_start_s": 180, "planned_duration_s": 120, "actual_start_s": 180, "actual_duration_s": 120, "outcome": "ok", "caption": "The balance tares and settles."},
    {"id": "A005", "origin": "planned", "step": "dispense", "phase": "act", "type": "pick", "object": "bottle_drug", "from": "slot_1", "planned_start_s": 300, "planned_duration_s": 60, "actual_start_s": 300, "actual_duration_s": 60, "outcome": "ok", "caption": "Pick the drug (active) bottle from its slot."},
    {"id": "A006", "origin": "planned", "step": "dispense", "phase": "act", "type": "pour", "object": "bottle_drug", "into": "vial", "at": "balance", "amount_g": 2.82, "planned_start_s": 360, "planned_duration_s": 120, "actual_start_s": 360, "actual_duration_s": 120, "outcome": "ok", "reading": {"quantity": "mass_g", "expected": 2.82, "value": 2.82}, "caption": "Pour the drug (active), weighed on the balance."},
    {"id": "A007", "origin": "planned", "step": "dispense", "phase": "act", "type": "place", "object": "bottle_drug", "to": "slot_1", "planned_start_s": 480, "planned_duration_s": 60, "actual_start_s": 480, "actual_duration_s": 60, "outcome": "ok", "caption": "Return the drug (active) bottle to its slot."},
    {"id": "A008", "origin": "planned", "step": "dispense", "phase": "act", "type": "pick", "object": "bottle_filler", "from": "slot_2", "planned_start_s": 540, "planned_duration_s": 60, "actual_start_s": 540, "actual_duration_s": 60, "outcome": "ok", "caption": "Pick the filler bottle from its slot."},
    {"id": "A009", "origin": "planned", "step": "dispense", "phase": "act", "type": "pour", "object": "bottle_filler", "into": "vial", "at": "balance", "amount_g": 15.16, "planned_start_s": 600, "planned_duration_s": 240, "actual_start_s": 600, "actual_duration_s": 240, "outcome": "ok", "reading": {"quantity": "mass_g", "expected": 15.16, "value": 15.16}, "caption": "Pour the filler, weighed on the balance."},
    {"id": "A010", "origin": "planned", "step": "dispense", "phase": "act", "type": "place", "object": "bottle_filler", "to": "slot_2", "planned_start_s": 840, "planned_duration_s": 60, "actual_start_s": 840, "actual_duration_s": 60, "outcome": "ok", "caption": "Return the filler bottle to its slot."},
    {"id": "A011", "origin": "planned", "step": "dispense", "phase": "act", "type": "pick", "object": "bottle_binder", "from": "slot_3", "planned_start_s": 900, "planned_duration_s": 60, "actual_start_s": 900, "actual_duration_s": 60, "outcome": "ok", "caption": "Pick the binder bottle from its slot."},
    {"id": "A012", "origin": "planned", "step": "dispense", "phase": "act", "type": "pour", "object": "bottle_binder", "into": "vial", "at": "balance", "amount_g": 0.86, "planned_start_s": 960, "planned_duration_s": 90, "actual_start_s": 960, "actual_duration_s": 25, "outcome": "failed", "caption": "Pour the binder, weighed on the balance. FAULT: the bottle jammed after 25 s.", "reading": {"quantity": "mass_g", "expected": 0.86, "value": 0.31}, "fault": {"cause": "binder bottle jam", "where": {"step": "dispense", "action": "pour", "ingredient": "binder_pct"}, "detail": "Powder stopped flowing. The balance reads 0.31 g, expected 0.86 g."}},
    {"id": "R001", "origin": "recovery", "step": "dispense", "phase": "act", "type": "shake", "object": "bottle_binder", "style": "tap", "recovers": "A012", "actual_start_s": 985, "actual_duration_s": 120, "outcome": "ok", "caption": "Tap and shake the jammed bottle to clear it."},
    {"id": "R002", "origin": "recovery", "step": "dispense", "phase": "act", "type": "place", "object": "bottle_binder", "to": "slot_3", "recovers": "A012", "actual_start_s": 1105, "actual_duration_s": 60, "outcome": "ok", "caption": "Put the bottle back in its slot before the purge."},
    {"id": "R003", "origin": "recovery", "step": "dispense", "phase": "act", "type": "wait", "reason": "dispenser purge and reset after the binder jam (60 minutes, from the setup)", "recovers": "A012", "actual_start_s": 1165, "actual_duration_s": 3600, "outcome": "ok", "caption": "Purge and reset the dispenser (60 minutes)."},
    {"id": "R004", "origin": "recovery", "step": "dispense", "phase": "act", "type": "pick", "object": "bottle_binder", "from": "slot_3", "recovers": "A012", "actual_start_s": 4765, "actual_duration_s": 60, "outcome": "ok", "caption": "Pick the binder bottle up again."},
    {"id": "R005", "origin": "recovery", "step": "dispense", "phase": "act", "type": "pour", "object": "bottle_binder", "into": "vial", "at": "balance", "amount_g": 0.55, "recovers": "A012", "actual_start_s": 4825, "actual_duration_s": 60, "outcome": "ok", "caption": "Retry: pour the rest of the binder.", "reading": {"quantity": "mass_g", "expected": 0.55, "value": 0.55}},
    {"id": "A013", "origin": "planned", "step": "dispense", "phase": "act", "type": "place", "object": "bottle_binder", "to": "slot_3", "planned_start_s": 1050, "planned_duration_s": 60, "actual_start_s": 4885, "actual_duration_s": 60, "outcome": "ok", "caption": "Return the binder bottle to its slot."},
    {"id": "A014", "origin": "planned", "step": "dispense", "phase": "act", "type": "pick", "object": "bottle_disintegrant", "from": "slot_4", "planned_start_s": 1110, "planned_duration_s": 60, "actual_start_s": 4945, "actual_duration_s": 60, "outcome": "ok", "caption": "Pick the disintegrant bottle from its slot."},
    {"id": "A015", "origin": "planned", "step": "dispense", "phase": "act", "type": "pour", "object": "bottle_disintegrant", "into": "vial", "at": "balance", "amount_g": 1.04, "planned_start_s": 1170, "planned_duration_s": 100, "actual_start_s": 5005, "actual_duration_s": 100, "outcome": "ok", "reading": {"quantity": "mass_g", "expected": 1.04, "value": 1.04}, "caption": "Pour the disintegrant, weighed on the balance."},
    {"id": "A016", "origin": "planned", "step": "dispense", "phase": "act", "type": "place", "object": "bottle_disintegrant", "to": "slot_4", "planned_start_s": 1270, "planned_duration_s": 60, "actual_start_s": 5105, "actual_duration_s": 60, "outcome": "ok", "caption": "Return the disintegrant bottle to its slot."},
    {"id": "A017", "origin": "planned", "step": "dispense", "phase": "act", "type": "pick", "object": "bottle_lubricant", "from": "slot_5", "planned_start_s": 1330, "planned_duration_s": 60, "actual_start_s": 5165, "actual_duration_s": 60, "outcome": "ok", "caption": "Pick the lubricant bottle from its slot."},
    {"id": "A018", "origin": "planned", "step": "dispense", "phase": "act", "type": "pour", "object": "bottle_lubricant", "into": "vial", "at": "balance", "amount_g": 0.12, "planned_start_s": 1390, "planned_duration_s": 80, "actual_start_s": 5225, "actual_duration_s": 80, "outcome": "ok", "reading": {"quantity": "mass_g", "expected": 0.12, "value": 0.12}, "caption": "Pour the lubricant, weighed on the balance."},
    {"id": "A019", "origin": "planned", "step": "dispense", "phase": "act", "type": "place", "object": "bottle_lubricant", "to": "slot_5", "planned_start_s": 1470, "planned_duration_s": 60, "actual_start_s": 5305, "actual_duration_s": 60, "outcome": "ok", "caption": "Return the lubricant bottle to its slot."},
    {"id": "A020", "origin": "planned", "step": "dispense", "phase": "act", "type": "read", "at": "balance", "quantity": "mass_g", "planned_start_s": 1530, "planned_duration_s": 30, "actual_start_s": 5365, "actual_duration_s": 30, "outcome": "ok", "reading": {"quantity": "mass_g", "value": 20.0}, "caption": "Check the total mass on the balance."},